{
  "$schema": "http://json-schema.org/draft-07/schema#",
  "$id": "https://terascope.github.io/teraslice/schemas/teraslice-job.schema.json",
  "title": "Teraslice Job",
  "description": "Configuration for a Teraslice job. Hand-written from packages/job-components/src/job-schemas.ts (jobSchema) and packages/types/src/teraslice.ts (ValidatedJobConfig, OpConfig, APIConfig).",
  "type": "object",
  "required": ["name", "operations"],
  "additionalProperties": false,
  "properties": {
    "$schema": {
      "type": "string",
      "description": "Optional pointer to this JSON Schema so editors pick it up without the extension/workspace config."
    },
    "name": {
      "type": "string",
      "minLength": 1,
      "default": "Custom Job",
      "description": "Name for specific job."
    },
    "lifecycle": {
      "type": "string",
      "enum": ["once", "persistent"],
      "default": "once",
      "description": "Job lifecycle behavior, determines if it should exit on completion or remain active."
    },
    "active": {
      "type": "boolean",
      "default": true,
      "description": "A convenience marker indicating whether the job is in active use. Teraslice does not use it."
    },
    "analytics": {
      "type": "boolean",
      "default": true,
      "description": "Logs the time it took in milliseconds for each action, as well as the number of docs it receives."
    },
    "assets": {
      "type": ["array", "null"],
      "items": { "type": "string" },
      "default": null,
      "description": "An array of strings that are the IDs (or names) for the corresponding asset zip files."
    },
    "autorecover": {
      "type": "boolean",
      "default": false,
      "description": "Automatically recover pending slices from the last stopped/completed execution."
    },
    "max_retries": {
      "type": "integer",
      "minimum": 0,
      "default": 3,
      "description": "The number of times a worker will attempt to process the same slice after an error has occurred."
    },
    "slicers": {
      "type": "integer",
      "minimum": 1,
      "default": 1,
      "description": "How many parallel slicer contexts that will run within the slicer."
    },
    "workers": {
      "type": "integer",
      "minimum": 1,
      "default": 1,
      "description": "The number of workers dedicated for the job. Runtime default is min(cpuCount, 5)."
    },
    "probation_window": {
      "type": ["integer", "string"],
      "default": 300000,
      "description": "Time in ms (or a duration string) the execution controller checks for failed slices before marking the execution running. Only applies when lifecycle is 'persistent'."
    },
    "stateful": {
      "type": "boolean",
      "default": false,
      "description": "Indicates that the Teraslice worker maintains internal state, and must be handled differently."
    },
    "log_level": {
      "type": ["string", "null"],
      "enum": ["trace", "debug", "info", "warn", "error", "fatal", null],
      "default": null,
      "description": "The log level to be set on all loggers associated with the job."
    },
    "labels": {
      "type": ["object", "null"],
      "default": null,
      "additionalProperties": { "type": "string" },
      "description": "Key/value pairs used to label kubernetes resources."
    },
    "env_vars": {
      "type": "object",
      "default": {},
      "additionalProperties": { "type": "string" },
      "description": "Environment variables to set on each Teraslice worker, e.g. { \"EXAMPLE\": \"test\" }."
    },
    "operations": {
      "type": "array",
      "minItems": 2,
      "description": "An array of actions to execute: typically the first is a reader and the last is a sender, with any number of processors in-between.",
      "items": { "$ref": "#/definitions/operation" }
    },
    "apis": {
      "type": "array",
      "default": [],
      "description": "An array of apis to load and any configuration they require. Unlike operations, none are required.",
      "items": { "$ref": "#/definitions/api" }
    },

    "targets": {
      "type": "array",
      "description": "Kubernetes only: array of key/value labels used for targeting teraslice jobs to nodes.",
      "items": { "$ref": "#/definitions/target" }
    },
    "cpu": {
      "type": "number",
      "deprecated": true,
      "description": "DEPRECATED (kubernetes): number of cpus to reserve per teraslice worker. Use resources_requests_cpu instead."
    },
    "cpu_execution_controller": {
      "type": "number",
      "description": "Kubernetes only: number of cpus to reserve per teraslice execution controller."
    },
    "ephemeral_storage": {
      "type": "boolean",
      "default": false,
      "description": "Kubernetes only: add an ephemeral storage volume to worker and execution controller pods."
    },
    "external_ports": {
      "type": "array",
      "description": "Kubernetes only: ports to expose as external ports on the pods. Each entry is a port number or { name, port }. Port 45680 is reserved by Teraslice.",
      "items": {
        "oneOf": [
          { "type": "integer" },
          { "$ref": "#/definitions/externalPort" }
        ]
      }
    },
    "memory": {
      "type": "number",
      "deprecated": true,
      "description": "DEPRECATED (kubernetes): memory, in bytes, to reserve per teraslice worker. Use resources_requests_memory instead."
    },
    "memory_execution_controller": {
      "type": "number",
      "description": "Kubernetes only: memory, in bytes, to reserve per teraslice execution controller."
    },
    "pod_spec_override": {
      "type": "object",
      "default": {},
      "description": "Kubernetes only: override the generated pod spec. Requires the master to set kubernetes_overrides_enabled: true."
    },
    "resources_requests_cpu": {
      "type": "number",
      "description": "Kubernetes only: CPU request, in cores, to set on Teraslice workers."
    },
    "resources_requests_memory": {
      "type": "number",
      "description": "Kubernetes only: memory request, in bytes, to set on Teraslice workers."
    },
    "resources_limits_cpu": {
      "type": "number",
      "description": "Kubernetes only: CPU limit, in cores, to set on Teraslice workers."
    },
    "resources_limits_memory": {
      "type": "number",
      "description": "Kubernetes only: memory limit, in bytes, to set on Teraslice workers."
    },
    "volumes": {
      "type": "array",
      "description": "Kubernetes only: array of volumes to be mounted by job workers.",
      "items": { "$ref": "#/definitions/volume" }
    },
    "kubernetes_image": {
      "type": "string",
      "description": "Kubernetes only: custom image name for the job."
    },
    "prom_metrics_enabled": {
      "type": "boolean",
      "description": "Kubernetes only: create a prometheus exporter. Overrides the terafoundation value."
    },
    "prom_metrics_port": {
      "type": "number",
      "description": "Kubernetes only: port of the prometheus exporter server. Overrides the terafoundation value."
    },
    "prom_metrics_add_default": {
      "type": "boolean",
      "description": "Kubernetes only: display default node metrics in the prom client. Overrides the terafoundation value."
    }
  },
  "definitions": {
    "operation": {
      "type": "object",
      "required": ["_op"],
      "additionalProperties": true,
      "description": "A single operation (reader, processor, or sender). Operation-specific options depend on _op and are provided by the asset; they are not validated here.",
      "properties": {
        "_op": {
          "type": "string",
          "minLength": 1,
          "description": "Name of the operation; must reflect the name of the file or folder providing it."
        },
        "_api_name": {
          "type": "string",
          "description": "The name of the API used by this operation (matches an entry in the top-level 'apis' array, optionally namespaced like 'example:0')."
        },
        "_connection": {
          "type": "string",
          "description": "The name of the connection; should match one listed in your sysconfig terafoundation.connectors."
        },
        "_encoding": {
          "type": "string",
          "enum": ["json", "raw"],
          "default": "json",
          "description": "Data encoding type used when calling DataEntity.fromBuffer."
        },
        "_dead_letter_action": {
          "type": "string",
          "default": "throw",
          "examples": ["throw", "log", "none"],
          "description": "What to do when a record fails to parse/transform. Builtins: 'throw' (throw the original error), 'log' (log error + data), 'none' (skip). Any other value is treated as a registered Dead Letter Queue API name."
        }
      }
    },
    "api": {
      "type": "object",
      "required": ["_name"],
      "additionalProperties": true,
      "description": "A single API or Observer loaded into the execution context. API-specific options depend on _name and are provided by the asset; they are not validated here.",
      "properties": {
        "_name": {
          "type": "string",
          "minLength": 1,
          "description": "Required, unique API name. May be namespaced with ':<id>' (e.g. 'example:0'); text after ':' is stripped when locating the file/folder."
        },
        "_encoding": {
          "type": "string",
          "enum": ["json", "raw"],
          "description": "Data encoding type used when calling DataEntity.fromBuffer."
        },
        "_dead_letter_action": {
          "type": "string",
          "default": "throw",
          "examples": ["throw", "log", "none"],
          "description": "What to do when a record fails to parse/transform. Builtins: 'throw', 'log', 'none'. Any other value is treated as a registered Dead Letter Queue API name."
        }
      }
    },
    "target": {
      "type": "object",
      "required": ["key", "value"],
      "description": "A kubernetes node-targeting label.",
      "properties": {
        "key": { "type": "string", "minLength": 1 },
        "value": { "type": "string", "minLength": 1 }
      }
    },
    "externalPort": {
      "type": "object",
      "required": ["name", "port"],
      "additionalProperties": false,
      "properties": {
        "name": { "type": "string", "minLength": 1 },
        "port": { "type": "integer" }
      }
    },
    "volume": {
      "type": "object",
      "required": ["name", "path"],
      "description": "A kubernetes volume mount.",
      "properties": {
        "name": { "type": "string", "minLength": 1 },
        "path": { "type": "string", "minLength": 1 }
      }
    }
  }
}
