{
    "name": "generator",
    "slicers": 1,
    "lifecycle": "persistent",
    "workers": 2,
    "analytics": false,
    "assets": ["elasticsearch", "standard"],
    "resources_requests_cpu": 0.1,
    "resources_limits_cpu": 0.5,
    "cpu_execution_controller": 0.2,
    "max_retries": 0,
    "operations": [
        {
            "_op": "data_generator",
            "size": 100
        },
        {
            "_op": "elasticsearch_bulk",
            "index": "replace-me-1000",
            "type": "events",
            "size": 1000
        }
    ]
  }
